{
    "proposalId": "prop-001",
    "timestamp": "2026-02-22T12:05:00Z",
    "success": true,
    "testResults": [
        {
            "testName": "Terminal Logic Build",
            "passed": true
        },
        {
            "testName": "Timeout Verification",
            "passed": true
        }
    ],
    "rollbackPerformed": false
}